{
  "$schema": "../../schemas/core/event-definition.schema.json",
  "topic": "workspace.appfactory.job.updated",
  "version": 1,
  "direction": "server->client",
  "owner": "core",
  "scope": "workspace",
  "payloadSchema": {
    "type": "object",
    "additionalProperties": false,
    "required": ["job"],
    "properties": {
      "job": {
        "$ref": "../../schemas/topics/workspace/workspace-app-factory-job.schema.json"
      }
    }
  }
}
