{
  "$schema": "../../schemas/core/event-definition.schema.json",
  "topic": "agent.activity.updated",
  "version": 1,
  "direction": "server->client",
  "owner": "agent",
  "scope": "workspace",
  "payloadSchema": {
    "type": "object",
    "additionalProperties": false,
    "required": ["workspaceId", "agentSessionId", "eventType", "data"],
    "oneOf": [
      {
        "type": "object",
        "additionalProperties": false,
        "required": ["workspaceId", "agentSessionId", "eventType", "data"],
        "properties": {
          "workspaceId": {
            "type": "string",
            "minLength": 1
          },
          "agentSessionId": {
            "type": "string",
            "minLength": 1
          },
          "eventType": {
            "const": "session_update"
          },
          "data": {
            "type": "object",
            "additionalProperties": false,
            "required": [
              "workspaceId",
              "agentSessionId",
              "eventType",
              "lastEventUnixMs"
            ],
            "properties": {
              "workspaceId": {
                "type": "string",
                "minLength": 1
              },
              "agentSessionId": {
                "type": "string",
                "minLength": 1
              },
              "eventType": {
                "const": "session_update"
              },
              "lastEventUnixMs": {
                "type": "integer",
                "minimum": 0
              }
            }
          }
        }
      },
      {
        "type": "object",
        "additionalProperties": false,
        "required": ["workspaceId", "agentSessionId", "eventType", "data"],
        "properties": {
          "workspaceId": {
            "type": "string",
            "minLength": 1
          },
          "agentSessionId": {
            "type": "string",
            "minLength": 1
          },
          "eventType": {
            "const": "session_deleted"
          },
          "data": {
            "type": "object",
            "additionalProperties": false,
            "required": [
              "workspaceId",
              "agentSessionId",
              "eventType",
              "deletedAtUnixMs"
            ],
            "properties": {
              "workspaceId": {
                "type": "string",
                "minLength": 1
              },
              "agentSessionId": {
                "type": "string",
                "minLength": 1
              },
              "eventType": {
                "const": "session_deleted"
              },
              "deletedAtUnixMs": {
                "type": "integer",
                "minimum": 0
              }
            }
          }
        }
      },
      {
        "type": "object",
        "additionalProperties": false,
        "required": ["workspaceId", "agentSessionId", "eventType", "data"],
        "properties": {
          "workspaceId": {
            "type": "string",
            "minLength": 1
          },
          "agentSessionId": {
            "type": "string",
            "minLength": 1
          },
          "eventType": {
            "const": "message_update"
          },
          "data": {
            "type": "object",
            "additionalProperties": false,
            "required": [
              "workspaceId",
              "agentSessionId",
              "eventType",
              "latestVersion",
              "acceptedCount",
              "messages"
            ],
            "properties": {
              "workspaceId": {
                "type": "string",
                "minLength": 1
              },
              "agentSessionId": {
                "type": "string",
                "minLength": 1
              },
              "eventType": {
                "const": "message_update"
              },
              "latestVersion": {
                "type": "integer",
                "minimum": 0
              },
              "acceptedCount": {
                "type": "integer",
                "minimum": 0
              },
              "messages": {
                "type": "array",
                "items": {
                  "type": "object",
                  "additionalProperties": false,
                  "required": [
                    "agentSessionId",
                    "id",
                    "kind",
                    "messageId",
                    "payload",
                    "role",
                    "version"
                  ],
                  "properties": {
                    "agentSessionId": {
                      "type": "string",
                      "minLength": 1
                    },
                    "id": {
                      "type": "integer",
                      "minimum": 0
                    },
                    "kind": {
                      "type": "string",
                      "minLength": 1
                    },
                    "messageId": {
                      "type": "string",
                      "minLength": 1
                    },
                    "payload": {
                      "type": "object"
                    },
                    "role": {
                      "type": "string",
                      "minLength": 1
                    },
                    "version": {
                      "type": "integer",
                      "minimum": 1
                    },
                    "turnId": {
                      "type": "string"
                    },
                    "status": {
                      "type": "string"
                    },
                    "occurredAtUnixMs": {
                      "type": "integer",
                      "minimum": 0
                    },
                    "startedAtUnixMs": {
                      "type": "integer",
                      "minimum": 0
                    },
                    "completedAtUnixMs": {
                      "type": "integer",
                      "minimum": 0
                    },
                    "createdAtUnixMs": {
                      "type": "integer",
                      "minimum": 0
                    },
                    "updatedAtUnixMs": {
                      "type": "integer",
                      "minimum": 0
                    }
                  }
                }
              }
            }
          }
        }
      },
      {
        "type": "object",
        "additionalProperties": false,
        "required": ["workspaceId", "agentSessionId", "eventType", "data"],
        "properties": {
          "workspaceId": {
            "type": "string",
            "minLength": 1
          },
          "agentSessionId": {
            "type": "string",
            "minLength": 1
          },
          "eventType": {
            "const": "state_patch"
          },
          "data": {
            "type": "object",
            "additionalProperties": false,
            "required": [
              "workspaceId",
              "agentSessionId",
              "eventType",
              "lastEventUnixMs"
            ],
            "properties": {
              "workspaceId": {
                "type": "string",
                "minLength": 1
              },
              "agentSessionId": {
                "type": "string",
                "minLength": 1
              },
              "eventType": {
                "const": "state_patch"
              },
              "lastEventUnixMs": {
                "type": "integer",
                "minimum": 0
              },
              "occurredAtUnixMs": {
                "type": "integer",
                "minimum": 0
              },
              "provider": {
                "type": "string"
              },
              "providerSessionId": {
                "type": "string"
              },
              "model": {
                "type": "string"
              },
              "cwd": {
                "type": "string"
              },
              "title": {
                "type": "string"
              },
              "lifecycleStatus": {
                "type": "string"
              },
              "currentPhase": {
                "type": "string"
              },
              "lastError": {
                "type": "string"
              },
              "startedAtUnixMs": {
                "type": "integer",
                "minimum": 0
              },
              "endedAtUnixMs": {
                "type": "integer",
                "minimum": 0
              },
              "turn": {
                "type": "object",
                "additionalProperties": false,
                "required": ["turnId"],
                "properties": {
                  "turnId": {
                    "type": "string",
                    "minLength": 1
                  },
                  "phase": {
                    "type": "string"
                  },
                  "outcome": {
                    "type": "string"
                  },
                  "fileChanges": true,
                  "startedAtUnixMs": {
                    "type": "integer",
                    "minimum": 0
                  },
                  "completedAtUnixMs": {
                    "type": "integer",
                    "minimum": 0
                  }
                }
              }
            }
          }
        }
      }
    ],
    "properties": {
      "workspaceId": {
        "type": "string",
        "minLength": 1
      },
      "agentSessionId": {
        "type": "string",
        "minLength": 1
      },
      "eventType": {
        "type": "string",
        "enum": [
          "session_update",
          "session_deleted",
          "message_update",
          "state_patch"
        ]
      },
      "data": true
    }
  }
}
