{
  "$schema": "../../schemas/core/event-definition.schema.json",
  "topic": "preferences.desktop.updated",
  "version": 1,
  "direction": "server->client",
  "owner": "core",
  "scope": "desktop",
  "payloadSchema": {
    "type": "object",
    "additionalProperties": false,
    "required": ["initialized", "preferences"],
    "properties": {
      "initialized": {
        "type": "boolean"
      },
      "preferences": {
        "$ref": "../../schemas/topics/preferences/desktop-preferences.schema.json"
      }
    }
  }
}
