{
  "$schema": "../../schemas/core/event-definition.schema.json",
  "topic": "workspace.app.updated",
  "version": 1,
  "direction": "server->client",
  "owner": "core",
  "scope": "workspace",
  "payloadSchema": {
    "type": "object",
    "additionalProperties": false,
    "required": ["app"],
    "properties": {
      "app": {
        "$ref": "../../schemas/topics/workspace/workspace-app.schema.json"
      }
    }
  }
}
