{
  "$schema": "../../schemas/core/event-definition.schema.json",
  "topic": "agent.gui.launch.requested",
  "version": 1,
  "direction": "server->client",
  "owner": "agent",
  "scope": "workspace",
  "payloadSchema": {
    "type": "object",
    "additionalProperties": false,
    "required": ["workspaceId", "agentSessionId", "provider", "source"],
    "properties": {
      "workspaceId": {
        "type": "string",
        "minLength": 1
      },
      "agentSessionId": {
        "type": "string",
        "minLength": 1
      },
      "provider": {
        "type": "string",
        "minLength": 1
      },
      "source": {
        "type": "string",
        "minLength": 1
      },
      "reason": {
        "type": "string",
        "minLength": 1
      },
      "requestId": {
        "type": "string",
        "minLength": 1
      }
    }
  }
}
